{"$schema":"https://json-schema.org/draft/2020-12/schema","title":"Continuity Works Corporate Language","type":"object","required":["corporate_language_id","version","name","sector_bias","design_language","palette","geometry_preferences"],"properties":{"corporate_language_id":{"type":"string","pattern":"^[a-z0-9_.-]+:corporate/[A-Za-z0-9_./-]+$"},"version":{"type":"integer","minimum":1},"name":{"type":"string","minLength":1},"sector_bias":{"type":"array","items":{"type":"string"},"minItems":1},"design_language":{"type":"object","required":["massing","silhouette_tokens"],"properties":{"massing":{"type":"string"},"silhouette_tokens":{"type":"array","items":{"type":"string"},"minItems":1}},"additionalProperties":true},"palette":{"type":"object","minProperties":1,"additionalProperties":{"type":"string","pattern":"^minecraft:[a-z0-9_./-]+$"}},"geometry_preferences":{"type":"object"}}}
