{"corporate_language_id":"continuityworks:corporate/helium_orbital_works","version":1,"name":"Helium Orbital Works","sector_bias":["industrial_launch","cargo_spaceflight","vehicle_integration"],"design_language":{"massing":"exposed_modular_truss","silhouette_tokens":["orange_service_frames","open_gantries","dense_utility_spines"],"facade_rhythm":"modular_structural","signage_geometry":"equipment_plate_and_band","lighting":"task_focused","maintenance":"active_industrial","public_service_contrast":"moderate"},"palette":{"foundation":"minecraft:smooth_stone","primary_wall":"minecraft:light_gray_concrete","secondary_wall":"minecraft:gray_concrete","accent_primary":"minecraft:orange_concrete","accent_secondary":"minecraft:white_concrete","roof":"minecraft:smooth_stone","glass":"minecraft:gray_stained_glass","metal":"minecraft:iron_block","dark_metal":"minecraft:polished_deepslate","hazard":"minecraft:yellow_concrete","lighting":"minecraft:shroomlight","ground":"minecraft:stone","gravel":"minecraft:gravel","pipe":"minecraft:copper_block","tank":"minecraft:white_concrete","fence":"minecraft:iron_bars","sign":"minecraft:orange_concrete","wood":"minecraft:stripped_spruce_wood","flare":"minecraft:campfire"},"geometry_preferences":{"tower":"open_truss","integration":"modular_frame","pad":"functional","symmetry":0.55}}
