{"corporate_language_id":"continuityworks:corporate/northstar_fuel","version":1,"name":"Northstar Fuel","sector_bias":["retail_fuel","travel_stop","distribution"],"design_language":{"massing":"clean_horizontal","silhouette_tokens":["thin_bright_canopy","tall_pylon","glazed_storefront"],"facade_rhythm":"regular","signage_geometry":"vertical_pylon_horizontal_band","lighting":"bright_even","maintenance":"high","public_service_contrast":"strong"},"palette":{"foundation":"minecraft:smooth_stone","primary_wall":"minecraft:white_concrete","secondary_wall":"minecraft:light_gray_concrete","accent_primary":"minecraft:red_concrete","accent_secondary":"minecraft:blue_concrete","roof":"minecraft:white_concrete","glass":"minecraft:light_blue_stained_glass","metal":"minecraft:iron_block","dark_metal":"minecraft:polished_deepslate","hazard":"minecraft:yellow_concrete","lighting":"minecraft:sea_lantern","ground":"minecraft:gray_concrete","gravel":"minecraft:gravel","pipe":"minecraft:light_gray_concrete","tank":"minecraft:smooth_quartz","fence":"minecraft:iron_bars","sign":"minecraft:white_concrete","wood":"minecraft:stripped_spruce_wood","flare":"minecraft:campfire"},"geometry_preferences":{"canopy_edge":"thin_banded","roof":"flat","corner_language":"square","symmetry":0.85}}
