{"corporate_language_id":"continuityworks:corporate/atlas_heavy_industries","version":1,"name":"Atlas Heavy Industries","sector_bias":["heavy_launch","superheavy_launch","megastructure_construction"],"design_language":{"massing":"massive_structural_utilitarian","silhouette_tokens":["oversized_frames","thick_platforms","exposed_service_blocks"],"facade_rhythm":"large_structural_bays","signage_geometry":"monumental_block_wordmark","lighting":"industrial_grid","maintenance":"rugged_orderly","public_service_contrast":"low"},"palette":{"foundation":"minecraft:stone_bricks","primary_wall":"minecraft:gray_concrete","secondary_wall":"minecraft:andesite","accent_primary":"minecraft:orange_concrete","accent_secondary":"minecraft:yellow_concrete","roof":"minecraft:polished_andesite","glass":"minecraft:gray_stained_glass","metal":"minecraft:iron_block","dark_metal":"minecraft:polished_blackstone","hazard":"minecraft:yellow_concrete","lighting":"minecraft:sea_lantern","ground":"minecraft:gray_concrete","gravel":"minecraft:gravel","pipe":"minecraft:copper_block","tank":"minecraft:light_gray_concrete","fence":"minecraft:iron_bars","sign":"minecraft:orange_concrete","wood":"minecraft:dark_oak_planks","flare":"minecraft:campfire"},"geometry_preferences":{"tower":"thick_frame","integration":"oversized_bay","pad":"massive_platform","symmetry":0.65}}
