{"corporate_language_id":"continuityworks:corporate/frontier_cooperative","version":1,"name":"Frontier Cooperative","sector_bias":["rural_retail_fuel","agricultural_service","small_distribution"],"design_language":{"massing":"practical_low_rise","silhouette_tokens":["compact_canopy","gable_store","low_monument_sign"],"facade_rhythm":"irregular_practical","signage_geometry":"low_board_or_short_pylon","lighting":"warm_sparse","maintenance":"serviceable","public_service_contrast":"moderate"},"palette":{"foundation":"minecraft:stone_bricks","primary_wall":"minecraft:sandstone","secondary_wall":"minecraft:stripped_spruce_wood","accent_primary":"minecraft:green_concrete","accent_secondary":"minecraft:yellow_concrete","roof":"minecraft:dark_oak_planks","glass":"minecraft:glass","metal":"minecraft:stone_bricks","dark_metal":"minecraft:polished_blackstone","hazard":"minecraft:yellow_concrete","lighting":"minecraft:lantern","ground":"minecraft:stone","gravel":"minecraft:gravel","pipe":"minecraft:cobblestone_wall","tank":"minecraft:light_gray_concrete","fence":"minecraft:oak_fence","sign":"minecraft:green_concrete","wood":"minecraft:stripped_spruce_wood","flare":"minecraft:campfire"},"geometry_preferences":{"canopy_edge":"heavy_simple","roof":"gable_preferred","corner_language":"chunky","symmetry":0.55}}
