{"corporate_language_id":"continuityworks:corporate/vcf_colonial_launch_authority","version":1,"name":"VCF Colonial Launch Authority","sector_bias":["colonial_spaceport","cargo_launch","underground_launch"],"design_language":{"massing":"standardized_robust_repetitive","silhouette_tokens":["repeatable_service_blocks","coded_color_bands","durable_frame_grids"],"facade_rhythm":"standardized_bays","signage_geometry":"coded_panel","lighting":"practical_redundant","maintenance":"serviceable","public_service_contrast":"moderate"},"palette":{"foundation":"minecraft:stone_bricks","primary_wall":"minecraft:light_gray_concrete","secondary_wall":"minecraft:stone","accent_primary":"minecraft:blue_concrete","accent_secondary":"minecraft:yellow_concrete","roof":"minecraft:stone_bricks","glass":"minecraft:glass","metal":"minecraft:iron_block","dark_metal":"minecraft:deepslate_bricks","hazard":"minecraft:yellow_concrete","lighting":"minecraft:lantern","ground":"minecraft:stone","gravel":"minecraft:gravel","pipe":"minecraft:copper_block","tank":"minecraft:light_gray_concrete","fence":"minecraft:iron_bars","sign":"minecraft:blue_concrete","wood":"minecraft:stripped_spruce_wood","flare":"minecraft:campfire"},"geometry_preferences":{"tower":"repeatable_grid","integration":"standardized_bay","pad":"modular","symmetry":0.7}}
