{"corporate_language_id":"continuityworks:corporate/asterion_aerospace","version":1,"name":"Asterion Aerospace","sector_bias":["orbital_launch","vehicle_integration","reusable_spaceflight"],"design_language":{"massing":"clean_monumental_precision","silhouette_tokens":["white_launch_towers","glazed_control_blocks","precise_horizontal_bands"],"facade_rhythm":"regular_high_order","signage_geometry":"thin_horizontal_wordmark","lighting":"bright_cool_even","maintenance":"immaculate","public_service_contrast":"strong"},"palette":{"foundation":"minecraft:smooth_stone","primary_wall":"minecraft:white_concrete","secondary_wall":"minecraft:light_gray_concrete","accent_primary":"minecraft:blue_concrete","accent_secondary":"minecraft:cyan_concrete","roof":"minecraft:smooth_quartz","glass":"minecraft:light_blue_stained_glass","metal":"minecraft:iron_block","dark_metal":"minecraft:polished_deepslate","hazard":"minecraft:yellow_concrete","lighting":"minecraft:sea_lantern","ground":"minecraft:light_gray_concrete","gravel":"minecraft:gravel","pipe":"minecraft:oxidized_cut_copper","tank":"minecraft:smooth_quartz","fence":"minecraft:iron_bars","sign":"minecraft:white_concrete","wood":"minecraft:stripped_birch_wood","flare":"minecraft:campfire"},"geometry_preferences":{"tower":"slender_precise","integration":"clean_rectilinear","pad":"high_symmetry","symmetry":0.9}}
