{"corporate_language_id":"continuityworks:corporate/atlas_basin_refining","version":1,"name":"Atlas Basin Refining","sector_bias":["refining","bulk_storage","distribution"],"design_language":{"massing":"legacy_process_campus","silhouette_tokens":["stacked_pipe_racks","pale_tanks","tall_columns"],"facade_rhythm":"repetitive_structural_bays","signage_geometry":"monumental_gate_wordmark","lighting":"cool_industrial","maintenance":"aged_orderly","public_service_contrast":"separated"},"palette":{"foundation":"minecraft:smooth_stone","primary_wall":"minecraft:stone_bricks","secondary_wall":"minecraft:bricks","accent_primary":"minecraft:blue_concrete","accent_secondary":"minecraft:orange_concrete","roof":"minecraft:smooth_stone","glass":"minecraft:gray_stained_glass","metal":"minecraft:iron_block","dark_metal":"minecraft:deepslate_tiles","hazard":"minecraft:yellow_concrete","lighting":"minecraft:sea_lantern","ground":"minecraft:light_gray_concrete","gravel":"minecraft:gravel","pipe":"minecraft:oxidized_cut_copper","tank":"minecraft:white_concrete","fence":"minecraft:iron_bars","sign":"minecraft:blue_concrete","wood":"minecraft:dark_oak_planks","flare":"minecraft:campfire"},"geometry_preferences":{"equipment_density":"medium_high","roof":"flat_service","corner_language":"rectilinear","symmetry":0.65}}
