{"corporate_language_id":"continuityworks:corporate/black_glass_launch_systems","version":1,"name":"Black Glass Launch Systems","sector_bias":["experimental_launch","tandem_launch","underground_launch"],"design_language":{"massing":"monolithic_dark_vertical","silhouette_tokens":["black_towers","tinted_control_glass","narrow_luminous_accents"],"facade_rhythm":"severe_sparse","signage_geometry":"minimal_vertical_mark","lighting":"high_contrast_sparse","maintenance":"controlled_pristine","public_service_contrast":"minimal"},"palette":{"foundation":"minecraft:deepslate_bricks","primary_wall":"minecraft:black_concrete","secondary_wall":"minecraft:polished_blackstone","accent_primary":"minecraft:purple_concrete","accent_secondary":"minecraft:cyan_concrete","roof":"minecraft:deepslate_tiles","glass":"minecraft:tinted_glass","metal":"minecraft:polished_blackstone","dark_metal":"minecraft:blackstone","hazard":"minecraft:yellow_concrete","lighting":"minecraft:end_rod","ground":"minecraft:gray_concrete","gravel":"minecraft:gravel","pipe":"minecraft:oxidized_copper","tank":"minecraft:gray_concrete","fence":"minecraft:iron_bars","sign":"minecraft:black_concrete","wood":"minecraft:dark_oak_planks","flare":"minecraft:soul_campfire"},"geometry_preferences":{"tower":"monolithic","integration":"dark_shell","pad":"recessed","symmetry":0.8}}
